{
  "name": "Kosova",
  "description": "Kosova Map",
  "pbf_path": "/pbf/kosovo-latest.osm.pbf",
  "render_type": "full",
  "zoom_levels": {
    "min_zoom": 0,
    "max_zoom": 10
  },
  "style": "osm-carto",
  "output_format": "png",
  "tile_size": 256,
  "created_at": "2025-08-21T23:30:47.480774",
  "updated_at": "2025-08-21T23:30:50.109738"
}